{
  "schema_version": "carnet.quote_repair_audit/1",
  "tooling_only": true,
  "note": "One entry per applied pilot quote repair. Review artefact: never read by union generation.",
  "entries": [
    {
      "evidence_id": "CM-009",
      "evidence_file": "evidence/toyota_camry.json",
      "source_id": "CM-S2",
      "reason": "quote_repair",
      "previous_quote": "Camry will be available in five grades: L, LE, XLE, SE and XSE. The excitement over the eighth-generation sedan Three new powertrains will be available on the new 2018 Camry: They include an all-new 2.5-liter inline-four-cylinder D-4S gasoline engine and a new 3.5-liter V6 with D-4S Fuel Injection, both of which are paired to a new eight-speed Direct-Shift automatic transmission (8AT); and a next-generation Toyota Hybrid System (THS II). Peak horsepower is estimated at 206 at 6,600 rpm (176 horsepower at 5,700 rpm in the hybrid configuration) with torque estimated at 186 lb.-ft. at 5,000 rpm (163 lb.-ft. at 3,600-5,200 rpm for the hybrid).",
      "replacement_quote": "Three new powertrains will be available on the new 2018 Camry: They include an all-new 2.5-liter inline-four-cylinder D-4S gasoline engine and a new 3.5-liter V6 with D-4S Fuel Injection, both of which are paired to a new eight-speed Direct-Shift automatic transmission (8AT); and a next-generation Toyota Hybrid System (THS II).",
      "proposal_classification": "SAFE_QUOTE_REPAIR",
      "proposal_confidence": "HIGH",
      "proposal_reason_code": "VERBATIM_PASSAGE_STATES_SAME_VALUES",
      "snapshot_path": "evidence/_source_text/CM-S2.txt",
      "snapshot_sha256": "09b52d5a9cb8cd60ed40057f8a5ff58cd0072d3e2f85e99be1fd6ec4a30d5a6c",
      "snapshot_promoted_from": null,
      "applied_at": "2026-10-04T14:43:41Z"
    },
    {
      "evidence_id": "CM-016",
      "evidence_file": "evidence/toyota_camry.json",
      "source_id": "CM-S3",
      "reason": "quote_repair",
      "previous_quote": "Grades Gas (3) Hybrid (4) Gas E Price Engine 2.5L Engine, 4 Cylinder Max Output (hp) 201 HP/6,600 RPM Max Torque 240 Nm/4,000-5000 RPM Transmission 8-Speed Automatic Transmission",
      "replacement_quote": "Gas E Price 109,825 Includes Shipping fee of 3,795 Engine 2.5L Engine, 4 Cylinder Max Output (hp) 201 HP/6,600 RPM Max Torque 240 Nm/4,000-5000 RPM Transmission 8-Speed Automatic Transmission",
      "proposal_classification": "SAFE_QUOTE_REPAIR",
      "proposal_confidence": "HIGH",
      "proposal_reason_code": "VERBATIM_PASSAGE_STATES_SAME_VALUES",
      "snapshot_path": "evidence/_source_text/CM-S3.txt",
      "snapshot_sha256": "87e7bdb8af015bd86f60c62aeeb2a34912fd4ed29bb987f686f6ec88c9814a31",
      "snapshot_promoted_from": "reports/quote_repair_snapshots/toyota_camry/CM-S3.txt",
      "applied_at": "2026-10-04T14:43:41Z"
    },
    {
      "evidence_id": "CM-017",
      "evidence_file": "evidence/toyota_camry.json",
      "source_id": "CM-S3",
      "reason": "quote_repair",
      "previous_quote": "Grades Gas (3) Hybrid (4) Gas LE Price Engine 2.5L Engine, 4 Cylinder Max Output (hp) 201 HP/6,600 RPM Max Torque 240 Nm/4,000-5000 RPM Transmission 8-Speed Automatic Transmission",
      "replacement_quote": "Gas LE Price 121,555 Includes Shipping fee of 3,795 Engine 2.5L Engine, 4 Cylinder Max Output (hp) 201 HP/6,600 RPM Max Torque 240 Nm/4,000-5000 RPM Transmission 8-Speed Automatic Transmission",
      "proposal_classification": "SAFE_QUOTE_REPAIR",
      "proposal_confidence": "HIGH",
      "proposal_reason_code": "VERBATIM_PASSAGE_STATES_SAME_VALUES",
      "snapshot_path": "evidence/_source_text/CM-S3.txt",
      "snapshot_sha256": "87e7bdb8af015bd86f60c62aeeb2a34912fd4ed29bb987f686f6ec88c9814a31",
      "snapshot_promoted_from": "reports/quote_repair_snapshots/toyota_camry/CM-S3.txt",
      "applied_at": "2026-10-04T14:43:41Z"
    },
    {
      "evidence_id": "CM-018",
      "evidence_file": "evidence/toyota_camry.json",
      "source_id": "CM-S3",
      "reason": "quote_repair",
      "previous_quote": "Grades Gas (3) Hybrid (4) Gas Grande Price Engine 2.5L Engine, 4 Cylinder Max Output (hp) 201 HP/6,600 RPM Max Torque 240 Nm/4,000-5000 RPM Transmission 8-Speed Automatic Transmission",
      "replacement_quote": "Gas Grande Price 145,475 Includes Shipping fee of 3,795 Engine 2.5L Engine, 4 Cylinder Max Output (hp) 201 HP/6,600 RPM Max Torque 240 Nm/4,000-5000 RPM Transmission 8-Speed Automatic Transmission",
      "proposal_classification": "SAFE_QUOTE_REPAIR",
      "proposal_confidence": "HIGH",
      "proposal_reason_code": "VERBATIM_PASSAGE_STATES_SAME_VALUES",
      "snapshot_path": "evidence/_source_text/CM-S3.txt",
      "snapshot_sha256": "87e7bdb8af015bd86f60c62aeeb2a34912fd4ed29bb987f686f6ec88c9814a31",
      "snapshot_promoted_from": "reports/quote_repair_snapshots/toyota_camry/CM-S3.txt",
      "applied_at": "2026-10-04T14:43:41Z"
    },
    {
      "evidence_id": "CM-019",
      "evidence_file": "evidence/toyota_camry.json",
      "source_id": "CM-S3",
      "reason": "quote_repair",
      "previous_quote": "Hybrid E HEV Price Engine 2.5L Engine, 4 Cylinder Max Output (hp) 226 HP/6,000 RPM Max Torque 221 Nm/3,600-5200 RPM Transmission Electronic Continuous Variable Transmission (E-CVT)",
      "replacement_quote": "Hybrid E HEV Price 111,090 Includes Shipping fee of 3,795 Engine 2.5L Engine, 4 Cylinder Max Output (hp) 226 HP/6,000 RPM Max Torque 221 Nm/3,600-5200 RPM Transmission Electronic Continuous Variable Transmission (E-CVT)",
      "proposal_classification": "SAFE_QUOTE_REPAIR",
      "proposal_confidence": "HIGH",
      "proposal_reason_code": "VERBATIM_PASSAGE_STATES_SAME_VALUES",
      "snapshot_path": "evidence/_source_text/CM-S3.txt",
      "snapshot_sha256": "87e7bdb8af015bd86f60c62aeeb2a34912fd4ed29bb987f686f6ec88c9814a31",
      "snapshot_promoted_from": "reports/quote_repair_snapshots/toyota_camry/CM-S3.txt",
      "applied_at": "2026-10-04T14:43:41Z"
    },
    {
      "evidence_id": "CM-020",
      "evidence_file": "evidence/toyota_camry.json",
      "source_id": "CM-S3",
      "reason": "quote_repair",
      "previous_quote": "Hybrid E Plus HEV Price Engine 2.5L Engine, 4 Cylinder Max Output (hp) 226 HP/6,000 RPM Max Torque 221 Nm/3,600-5200 RPM Transmission Electronic Continuous Variable Transmission (E-CVT)",
      "replacement_quote": "Hybrid E Plus HEV Price 116,035 Includes Shipping fee of 3,795 Engine 2.5L Engine, 4 Cylinder Max Output (hp) 226 HP/6,000 RPM Max Torque 221 Nm/3,600-5200 RPM Transmission Electronic Continuous Variable Transmission (E-CVT)",
      "proposal_classification": "SAFE_QUOTE_REPAIR",
      "proposal_confidence": "HIGH",
      "proposal_reason_code": "VERBATIM_PASSAGE_STATES_SAME_VALUES",
      "snapshot_path": "evidence/_source_text/CM-S3.txt",
      "snapshot_sha256": "87e7bdb8af015bd86f60c62aeeb2a34912fd4ed29bb987f686f6ec88c9814a31",
      "snapshot_promoted_from": "reports/quote_repair_snapshots/toyota_camry/CM-S3.txt",
      "applied_at": "2026-10-04T14:43:41Z"
    },
    {
      "evidence_id": "CM-023",
      "evidence_file": "evidence/toyota_camry.json",
      "source_id": "CM-S4",
      "reason": "quote_repair",
      "previous_quote": "The New Toyota Camry 2026 Sedan - Price & Specs | Toyota UAE 2.5L CAMRY 2026 2.5L 4-Cylinder, 16V DOHC",
      "replacement_quote": "The New Toyota Camry 2026 Sedan - Price & Specs | Toyota UAE … 2.5L 4-Cylinder, 16V DOHC",
      "proposal_classification": "SAFE_QUOTE_REPAIR",
      "proposal_confidence": "HIGH",
      "proposal_reason_code": "VERBATIM_PASSAGE_STATES_SAME_VALUES",
      "snapshot_path": "evidence/_source_text/CM-S4.txt",
      "snapshot_sha256": "394f2646bcf2f596ac5bce1c7bdfb2863bb9b1664b62b4afb81c246ca1c2f4dc",
      "snapshot_promoted_from": "reports/quote_repair_snapshots/toyota_camry/CM-S4.txt",
      "applied_at": "2026-10-04T14:43:41Z"
    },
    {
      "evidence_id": "FE-014",
      "evidence_file": "evidence/ford_everest.json",
      "source_id": "FE-S3",
      "reason": "quote_repair",
      "previous_quote": "Additionally, a 2.0L Single-Turbo diesel comes standard with a 6-speed automatic, supplying 168HP and 405Nm of torque providing strong low speed torque, great low speed throttle response and optimum fuel economy.",
      "replacement_quote": "Additionally, a 2.0L Single-Turbo diesel comes standard with a 6-speed automatic, supplying 168HP and 405Nm of torque providing strong low speed torque, great low speed throttle response and optimum fuel economy",
      "proposal_classification": "SAFE_QUOTE_REPAIR",
      "proposal_confidence": "HIGH",
      "proposal_reason_code": "VERBATIM_PASSAGE_STATES_SAME_VALUES",
      "snapshot_path": "evidence/_source_text/FE-S3.txt",
      "snapshot_sha256": "5be7d726d182103c5444af16dee1c0fa479d2b2b91ee2e41477426aaaf65b759",
      "snapshot_promoted_from": null,
      "applied_at": "2026-10-04T14:43:41Z"
    },
    {
      "evidence_id": "FE-015",
      "evidence_file": "evidence/ford_everest.json",
      "source_id": "FE-S3",
      "reason": "quote_repair",
      "previous_quote": "Inside, premium levels of craftsmanship have created a quiet and refined sanctuary for up to seven. Next-Gen Ford Everest is ready to go, with a 4x4 system utilizing a 2-speed Electronic Shift On the Fly (ESOF) transfer case. a rugged, refined, and fun-to-drive SUV",
      "replacement_quote": "a rugged, refined, and fun-to-drive SUV. … Inside, premium levels of craftsmanship have created a quiet and refined sanctuary for up to seven, … Next-Gen Ford Everest is ready to go, with a 4x4 system utilizing a 2-speed Electronic Shift On the Fly (ESOF) transfer case,",
      "proposal_classification": "SAFE_QUOTE_REPAIR",
      "proposal_confidence": "HIGH",
      "proposal_reason_code": "VERBATIM_PASSAGE_STATES_SAME_VALUES",
      "snapshot_path": "evidence/_source_text/FE-S3.txt",
      "snapshot_sha256": "5be7d726d182103c5444af16dee1c0fa479d2b2b91ee2e41477426aaaf65b759",
      "snapshot_promoted_from": null,